{
  "schemaVersion": "v1",
  "chartType": "ei-support",
  "state": "OR",
  "totalDistricts": 6,
  "election": "2024 Presidential",
  "selectedCandidate": "Hardy",
  "units": { "share": "decimal_0_to_1" },
  "series": [
    { "key": "latino", "label": "Latino", "confidenceScore": 0.82, "points": [
      { "xSupportShare": 0.20, "density": 0.1 }, { "xSupportShare": 0.30, "density": 0.4 }, { "xSupportShare": 0.40, "density": 1.1 }, { "xSupportShare": 0.50, "density": 2.2 }, { "xSupportShare": 0.60, "density": 3.3 }, { "xSupportShare": 0.70, "density": 3.7 }, { "xSupportShare": 0.80, "density": 2.9 }, { "xSupportShare": 0.90, "density": 1.2 }
    ]},
    { "key": "non_latino", "label": "Non-Latino", "confidenceScore": 0.71, "points": [
      { "xSupportShare": 0.10, "density": 0.2 }, { "xSupportShare": 0.20, "density": 1.3 }, { "xSupportShare": 0.30, "density": 3.6 }, { "xSupportShare": 0.40, "density": 2.8 }, { "xSupportShare": 0.50, "density": 1.0 }, { "xSupportShare": 0.60, "density": 0.3 }, { "xSupportShare": 0.70, "density": 0.05 }
    ]}
  ]
}
