{
  "schemaVersion": "v1",
  "chartType": "ei-support",
  "state": "SC",
  "totalDistricts": 7,
  "election": "2024 Presidential",
  "selectedCandidate": "Hardy",
  "units": { "share": "decimal_0_to_1" },
  "series": [
    { "key": "black", "label": "Black", "confidenceScore": 0.89, "points": [
      { "xSupportShare": 0.30, "density": 0.2 }, { "xSupportShare": 0.40, "density": 0.9 }, { "xSupportShare": 0.50, "density": 2.1 }, { "xSupportShare": 0.60, "density": 3.5 }, { "xSupportShare": 0.70, "density": 4.2 }, { "xSupportShare": 0.80, "density": 3.1 }, { "xSupportShare": 0.90, "density": 1.1 }
    ]},
    { "key": "non_black", "label": "Non-Black", "confidenceScore": 0.84, "points": [
      { "xSupportShare": 0.05, "density": 0.4 }, { "xSupportShare": 0.10, "density": 1.6 }, { "xSupportShare": 0.15, "density": 3.4 }, { "xSupportShare": 0.20, "density": 4.0 }, { "xSupportShare": 0.25, "density": 2.2 }, { "xSupportShare": 0.30, "density": 0.8 }, { "xSupportShare": 0.35, "density": 0.2 }
    ]}
  ]
}
